{
  "$schema": "https://nativeui.qzz.io/schema/registry-item.json",
  "name": "dialog",
  "type": "registry:component",
  "title": "Dialog",
  "description": "Dialog component",
  "registryDependencies": [],
  "dependencies": [
    "@expo/vector-icons/AntDesign",
    "@rn-primitives/dialog",
    "react-native-reanimated",
    "react-native-screens"
  ],
  "category": "feedback",
  "files": [
    {
      "path": "components/ui/dialog.tsx",
      "type": "registry:component",
      "target": "components/ui/dialog.tsx",
      "content": "import { THEME, useTheme } from \"@/lib/theme\";\nimport AntDesign from \"@expo/vector-icons/AntDesign\";\nimport * as DialogPrimitive from \"@rn-primitives/dialog\";\nimport React, { forwardRef } from \"react\";\nimport { Platform, Pressable, StyleSheet, Text, View, type StyleProp, type TextStyle, type ViewProps, type ViewStyle, } from \"react-native\";\nimport Animated, { FadeIn, FadeOut, ZoomIn, ZoomOut, } from \"react-native-reanimated\";\nimport { FullWindowOverlay as RNFullWindowOverlay } from \"react-native-screens\";\nconst FullWindowOverlay = Platform.OS === \"ios\" ? RNFullWindowOverlay : React.Fragment;\nconst isNative = Platform.OS !== \"web\";\nconst Dialog = DialogPrimitive.Root;\nconst DialogTrigger = DialogPrimitive.Trigger;\nconst DialogPortal = DialogPrimitive.Portal;\nconst DialogClose = DialogPrimitive.Close;\nDialog.displayName = \"Dialog\";\nDialogTrigger.displayName = \"DialogTrigger\";\nDialogClose.displayName = \"DialogClose\";\ntype DialogOverlayProps = Omit<React.ComponentProps<typeof DialogPrimitive.Overlay>, \"asChild\"> & {\n    children?: React.ReactNode;\n    style?: StyleProp<ViewStyle>;\n};\nconst DialogOverlay = forwardRef<View, DialogOverlayProps>(({ children, style, ...rest }, ref) => {\n    return (<FullWindowOverlay>\n        <DialogPrimitive.Overlay closeOnPress {...rest} asChild={isNative}>\n          <Animated.View ref={ref} entering={isNative ? FadeIn.duration(200) : undefined} exiting={isNative ? FadeOut.duration(180) : undefined} style={StyleSheet.flatten([\n            styles.overlay,\n            Platform.OS === \"web\" && { position: \"fixed\" as any, zIndex: 50 },\n            style,\n        ])} accessibilityElementsHidden={false} importantForAccessibility=\"yes\">\n            <Animated.View entering={isNative ? FadeIn.duration(200).delay(30) : undefined} exiting={isNative ? FadeOut.duration(150) : undefined} style={StyleSheet.flatten([\n            StyleSheet.absoluteFill,\n            { pointerEvents: \"box-none\" },\n            Platform.OS === \"web\" && { position: \"fixed\" as any },\n        ])}>\n              {children}\n            </Animated.View>\n          </Animated.View>\n        </DialogPrimitive.Overlay>\n      </FullWindowOverlay>);\n});\nDialogOverlay.displayName = \"DialogOverlay\";\ntype DialogContentProps = Omit<React.ComponentProps<typeof DialogPrimitive.Content>, \"asChild\"> & {\n    portalHost?: string;\n    showCloseButton?: boolean;\n    style?: StyleProp<ViewStyle>;\n    children?: React.ReactNode;\n};\nconst DialogContent = forwardRef<View, DialogContentProps>(({ portalHost, showCloseButton = true, style, children, accessibilityLabel = \"Dialog\", ...rest }, ref) => {\n    const { theme } = useTheme();\n    const { colors, spacing, radius } = THEME[theme];\n    const contentNode = (<DialogPrimitive.Content {...rest} asChild={isNative} accessibilityRole=\"none\">\n        <Animated.View ref={ref} entering={isNative ? ZoomIn.duration(220).springify() : undefined} exiting={isNative ? ZoomOut.duration(180) : undefined} accessibilityRole=\"none\" accessibilityLabel={accessibilityLabel} accessibilityViewIsModal importantForAccessibility=\"yes\" style={StyleSheet.flatten([\n            {\n                backgroundColor: colors.popover,\n                borderRadius: radius.xl,\n                borderWidth: StyleSheet.hairlineWidth,\n                borderColor: colors.border,\n                padding: spacing[\"2xl\"],\n                gap: spacing.lg,\n                width: \"100%\",\n                maxWidth: 512,\n                ...Platform.select({\n                    ios: {\n                        shadowColor: \"#000\",\n                        shadowOffset: { width: 0, height: 8 },\n                        shadowOpacity: 0.12,\n                        shadowRadius: 24,\n                    },\n                    android: { elevation: 12 },\n                    web: {\n                        boxShadow: \"0px 8px 24px rgba(0,0,0,0.12)\",\n                        position: \"fixed\" as any,\n                        top: \"50%\",\n                        left: \"50%\",\n                        transform: \"translate(-50%, -50%)\",\n                        zIndex: 51,\n                    },\n                }),\n            },\n            style,\n        ])}>\n          {children}\n\n          {showCloseButton && (<View style={{\n                position: \"absolute\",\n                top: spacing.lg,\n                right: spacing.lg,\n                zIndex: 100,\n            }}>\n              <DialogPrimitive.Close asChild>\n                <Pressable accessibilityRole=\"button\" accessibilityLabel=\"Close dialog\" hitSlop={12} style={({ pressed }) => StyleSheet.flatten([\n                {\n                    width: 28,\n                    height: 28,\n                    borderRadius: radius.md,\n                    alignItems: \"center\",\n                    justifyContent: \"center\",\n                    backgroundColor: pressed\n                        ? colors.accent\n                        : \"transparent\",\n                    opacity: pressed ? 1 : 0.7,\n                },\n            ])}>\n                  <AntDesign name=\"close\" size={16} color={colors.popoverForeground} strokeWidth={2}/>\n                </Pressable>\n              </DialogPrimitive.Close>\n            </View>)}\n        </Animated.View>\n      </DialogPrimitive.Content>);\n    if (Platform.OS === \"web\") {\n        return (<DialogPortal hostName={portalHost}>\n          <DialogOverlay />\n          {contentNode}\n        </DialogPortal>);\n    }\n    return (<DialogPortal hostName={portalHost}>\n        <DialogOverlay>{contentNode}</DialogOverlay>\n      </DialogPortal>);\n});\nDialogContent.displayName = \"DialogContent\";\ntype DialogHeaderProps = ViewProps & {\n    style?: StyleProp<ViewStyle>;\n};\nconst DialogHeader = forwardRef<View, DialogHeaderProps>(({ style, ...rest }, ref) => {\n    const { theme } = useTheme();\n    const { spacing } = THEME[theme];\n    return (<View ref={ref} {...rest} style={[{ flexDirection: \"column\", gap: spacing.xs }, style]}/>);\n});\nDialogHeader.displayName = \"DialogHeader\";\ntype DialogFooterProps = ViewProps & {\n    style?: StyleProp<ViewStyle>;\n};\nconst DialogFooter = forwardRef<View, DialogFooterProps>(({ style, ...rest }, ref) => {\n    const { theme } = useTheme();\n    const { spacing } = THEME[theme];\n    return (<View ref={ref} {...rest} style={[\n            {\n                flexDirection: \"row\",\n                justifyContent: \"flex-end\",\n                gap: spacing.sm,\n                flexWrap: \"wrap\",\n            },\n            style,\n        ]}/>);\n});\nDialogFooter.displayName = \"DialogFooter\";\ntype DialogTitleProps = React.ComponentProps<typeof DialogPrimitive.Title> & {\n    style?: StyleProp<TextStyle>;\n};\nconst DialogTitle = forwardRef<Text, DialogTitleProps>(({ style, ...rest }, ref) => {\n    const { theme } = useTheme();\n    const { colors, typography } = THEME[theme];\n    return (<DialogPrimitive.Title ref={ref} {...rest} style={StyleSheet.flatten([\n            {\n                fontSize: typography.lg,\n                fontWeight: \"700\",\n                color: colors.popoverForeground,\n                letterSpacing: -0.3,\n            },\n            style,\n        ])}/>);\n});\nDialogTitle.displayName = \"DialogTitle\";\ntype DialogDescriptionProps = React.ComponentProps<typeof DialogPrimitive.Description> & {\n    style?: StyleProp<TextStyle>;\n};\nconst DialogDescription = forwardRef<Text, DialogDescriptionProps>(({ style, ...rest }, ref) => {\n    const { theme } = useTheme();\n    const { colors, typography } = THEME[theme];\n    return (<DialogPrimitive.Description ref={ref} {...rest} style={StyleSheet.flatten([\n            {\n                fontSize: typography.sm,\n                lineHeight: typography.sm * 1.6,\n                color: colors.mutedForeground,\n            },\n            style,\n        ])}/>);\n});\nDialogDescription.displayName = \"DialogDescription\";\nconst styles = StyleSheet.create({\n    overlay: {\n        ...StyleSheet.absoluteFillObject,\n        backgroundColor: \"rgba(0,0,0,0.5)\",\n        alignItems: \"center\",\n        justifyContent: \"center\",\n        padding: 16,\n    },\n});\nexport { Dialog, DialogClose, DialogContent, DialogDescription, DialogFooter, DialogHeader, DialogOverlay, DialogPortal, DialogTitle, DialogTrigger, };\nexport const DialogCompound = {\n    Root: Dialog,\n    Trigger: DialogTrigger,\n    Portal: DialogPortal,\n    Overlay: DialogOverlay,\n    Content: DialogContent,\n    Header: DialogHeader,\n    Footer: DialogFooter,\n    Title: DialogTitle,\n    Description: DialogDescription,\n    Close: DialogClose,\n};"
    }
  ]
}
