{
  "$schema": "https://nativeui.qzz.io/schema/registry-item.json",
  "name": "switch",
  "type": "registry:component",
  "title": "Switch",
  "description": "Switch component",
  "registryDependencies": [],
  "dependencies": ["react-native-reanimated"],
  "category": "forms",
  "files": [
    {
      "path": "components/ui/switch.tsx",
      "type": "registry:component",
      "target": "components/ui/switch.tsx",
      "content": "import { THEME, useTheme } from \"@/lib/theme\";\nimport { forwardRef, useEffect } from \"react\";\nimport { Pressable, type View, type PressableProps } from \"react-native\";\nimport Animated, { interpolateColor, useAnimatedStyle, useSharedValue, withTiming, } from \"react-native-reanimated\";\ntype SwitchProps = {\n    value: boolean;\n    onValueChange: (value: boolean) => void;\n    disabled?: boolean;\n} & Omit<PressableProps, \"style\" | \"value\" | \"onPress\">;\nconst TRACK_WIDTH = 44;\nconst TRACK_HEIGHT = 24;\nconst THUMB_SIZE = 20;\nconst TRACK_PADDING = 2;\nconst TRANSLATE_X_MAX = TRACK_WIDTH - THUMB_SIZE - TRACK_PADDING * 2;\nexport const Switch = forwardRef<View, SwitchProps>(({ value = false, onValueChange, disabled = false, accessibilityLabel, accessibilityHint, ...rest }, ref) => {\n    const { theme } = useTheme();\n    const { colors } = THEME[theme];\n    const progress = useSharedValue(value ? 1 : 0);\n    useEffect(() => {\n        progress.value = withTiming(value ? 1 : 0, { duration: 200 });\n    }, [value, progress]);\n    const trackAnimatedStyle = useAnimatedStyle(() => {\n        return {\n            backgroundColor: interpolateColor(progress.value, [0, 1], [colors.input, colors.primary]),\n        };\n    });\n    const thumbAnimatedStyle = useAnimatedStyle(() => {\n        return {\n            transform: [\n                {\n                    translateX: progress.value * TRANSLATE_X_MAX,\n                },\n            ],\n        };\n    });\n    const handlePress = () => {\n        if (disabled)\n            return;\n        onValueChange?.(!value);\n    };\n    return (<Pressable ref={ref} onPress={handlePress} disabled={disabled} accessibilityRole=\"switch\" accessibilityState={{ checked: value, disabled }} accessibilityLabel={accessibilityLabel} accessibilityHint={accessibilityHint} {...rest} style={[\n            {\n                width: TRACK_WIDTH,\n                height: TRACK_HEIGHT,\n                padding: TRACK_PADDING,\n                borderRadius: 999,\n                justifyContent: \"center\",\n                opacity: disabled ? 0.5 : 1,\n            },\n        ]}>\n        <Animated.View style={[\n            {\n                ...StyleSheet.absoluteFillObject,\n                borderRadius: 999,\n            },\n            trackAnimatedStyle,\n        ]}/>\n\n        <Animated.View style={[\n            {\n                width: THUMB_SIZE,\n                height: THUMB_SIZE,\n                backgroundColor: colors.background,\n                borderRadius: 999,\n                shadowColor: \"#000\",\n                shadowOffset: { width: 0, height: 2 },\n                shadowOpacity: 0.2,\n                shadowRadius: 2,\n                elevation: 2,\n            },\n            thumbAnimatedStyle,\n        ]}/>\n      </Pressable>);\n});\nimport { StyleSheet } from \"react-native\";\nSwitch.displayName = \"Switch\";\nexport default Switch;"
    }
  ]
}
