{
  "$schema": "https://nativeui.qzz.io/schema/registry-item.json",
  "name": "alert-dialog",
  "type": "registry:component",
  "title": "Alert Dialog",
  "description": "Alert Dialog component",
  "registryDependencies": [],
  "dependencies": [
    "@rn-primitives/alert-dialog",
    "react-native-reanimated",
    "react-native-screens"
  ],
  "category": "feedback",
  "files": [
    {
      "path": "components/ui/alert-dialog.tsx",
      "type": "registry:component",
      "target": "components/ui/alert-dialog.tsx",
      "content": "import { THEME, useTheme } from \"@/lib/theme\";\nimport * as AlertDialogPrimitive from \"@rn-primitives/alert-dialog\";\nimport * as React from \"react\";\nimport { Platform, StyleSheet, Text, View, type ViewProps } from \"react-native\";\nimport Animated, { FadeIn, FadeOut } from \"react-native-reanimated\";\nimport { FullWindowOverlay as RNFullWindowOverlay } from \"react-native-screens\";\nconst isNative = Platform.OS !== \"web\";\nconst AlertDialog = AlertDialogPrimitive.Root;\nconst AlertDialogTrigger = AlertDialogPrimitive.Trigger;\nconst AlertDialogPortal = AlertDialogPrimitive.Portal;\nconst FullWindowOverlay = Platform.OS === \"ios\" ? RNFullWindowOverlay : React.Fragment;\nconst AlertDialogOverlay = React.forwardRef<React.ElementRef<typeof AlertDialogPrimitive.Overlay>, React.ComponentPropsWithoutRef<typeof AlertDialogPrimitive.Overlay>>(({ children, style, ...props }, ref) => {\n    const { theme } = useTheme();\n    const { spacing } = THEME[theme];\n    return (<FullWindowOverlay>\n      <AlertDialogPrimitive.Overlay ref={ref} {...props} asChild={isNative}>\n        <Animated.View entering={isNative ? FadeIn.duration(200) : undefined} exiting={isNative ? FadeOut.duration(200) : undefined} style={StyleSheet.flatten([\n            StyleSheet.absoluteFill,\n            {\n                backgroundColor: \"rgba(0, 0, 0, 0.5)\",\n                justifyContent: \"center\",\n                alignItems: \"center\",\n                padding: spacing.xl,\n            },\n            Platform.OS === \"web\" && ({ position: \"fixed\", zIndex: 50 } as any),\n            style,\n        ])}>\n          {children}\n        </Animated.View>\n      </AlertDialogPrimitive.Overlay>\n    </FullWindowOverlay>);\n});\nAlertDialogOverlay.displayName = \"AlertDialogOverlay\";\nconst AlertDialogContent = React.forwardRef<React.ElementRef<typeof AlertDialogPrimitive.Content>, React.ComponentPropsWithoutRef<typeof AlertDialogPrimitive.Content> & {\n    portalHost?: string;\n}>(({ children, style, portalHost, ...props }, ref) => {\n    const { theme } = useTheme();\n    const { colors, radius, spacing } = THEME[theme];\n    const contentNode = (<AlertDialogPrimitive.Content ref={ref} {...props} asChild={isNative}>\n      <Animated.View entering={isNative ? FadeIn.duration(200).delay(50) : undefined} exiting={isNative ? FadeOut.duration(150) : undefined} style={StyleSheet.flatten([\n            {\n                backgroundColor: colors.background,\n                borderRadius: radius.lg,\n                padding: spacing.xl,\n                width: \"100%\",\n                maxWidth: 400,\n                borderWidth: 1,\n                borderColor: colors.border,\n                gap: spacing.md,\n                ...Platform.select({\n                    ios: {\n                        shadowColor: \"#000\",\n                        shadowOffset: { width: 0, height: 2 },\n                        shadowOpacity: 0.1,\n                        shadowRadius: 8,\n                    },\n                    android: { elevation: 5 },\n                    web: {\n                        boxShadow: \"0px 2px 8px rgba(0,0,0,0.1)\",\n                        position: \"fixed\",\n                        top: \"50%\",\n                        left: \"50%\",\n                        transform: \"translate(-50%, -50%)\",\n                        zIndex: 51,\n                    } as any,\n                }),\n            },\n            style,\n        ])}>\n        {children}\n      </Animated.View>\n    </AlertDialogPrimitive.Content>);\n    if (Platform.OS === \"web\") {\n        return (<AlertDialogPortal hostName={portalHost}>\n        <AlertDialogOverlay />\n        {contentNode}\n      </AlertDialogPortal>);\n    }\n    return (<AlertDialogPortal hostName={portalHost}>\n      <AlertDialogOverlay>{contentNode}</AlertDialogOverlay>\n    </AlertDialogPortal>);\n});\nAlertDialogContent.displayName = \"AlertDialogContent\";\nconst AlertDialogHeader = ({ style, ...props }: ViewProps) => {\n    const { theme } = useTheme();\n    const { spacing } = THEME[theme];\n    return (<View style={StyleSheet.flatten([{ gap: spacing.sm }, style])} {...props}/>);\n};\nAlertDialogHeader.displayName = \"AlertDialogHeader\";\nconst AlertDialogFooter = ({ style, ...props }: ViewProps) => {\n    const { theme } = useTheme();\n    const { spacing } = THEME[theme];\n    return (<View style={StyleSheet.flatten([\n            {\n                flexDirection: \"row\",\n                justifyContent: \"flex-end\",\n                alignItems: \"center\",\n                gap: spacing.sm,\n                marginTop: spacing.sm,\n                flexWrap: \"wrap\",\n            },\n            style,\n        ])} {...props}/>);\n};\nAlertDialogFooter.displayName = \"AlertDialogFooter\";\nconst AlertDialogTitle = React.forwardRef<React.ElementRef<typeof AlertDialogPrimitive.Title>, React.ComponentPropsWithoutRef<typeof AlertDialogPrimitive.Title>>(({ style, ...props }, ref) => {\n    const { theme } = useTheme();\n    const { colors, typography } = THEME[theme];\n    return (<AlertDialogPrimitive.Title ref={ref} asChild>\n      <Text style={StyleSheet.flatten([\n            {\n                fontSize: typography.lg,\n                fontWeight: \"600\",\n                color: colors.foreground,\n            },\n            style,\n        ])} {...props}/>\n    </AlertDialogPrimitive.Title>);\n});\nAlertDialogTitle.displayName = \"AlertDialogTitle\";\nconst AlertDialogDescription = React.forwardRef<React.ElementRef<typeof AlertDialogPrimitive.Description>, React.ComponentPropsWithoutRef<typeof AlertDialogPrimitive.Description>>(({ style, ...props }, ref) => {\n    const { theme } = useTheme();\n    const { colors, typography } = THEME[theme];\n    return (<AlertDialogPrimitive.Description ref={ref} asChild>\n      <Text style={StyleSheet.flatten([\n            {\n                fontSize: typography.sm,\n                color: colors.mutedForeground,\n                lineHeight: typography.sm * 1.5,\n            },\n            style,\n        ])} {...props}/>\n    </AlertDialogPrimitive.Description>);\n});\nAlertDialogDescription.displayName = \"AlertDialogDescription\";\nconst AlertDialogAction = React.forwardRef<React.ElementRef<typeof AlertDialogPrimitive.Action>, React.ComponentPropsWithoutRef<typeof AlertDialogPrimitive.Action>>(({ style, ...props }, ref) => (<AlertDialogPrimitive.Action ref={ref} style={StyleSheet.flatten([style]) as any} {...props}/>));\nAlertDialogAction.displayName = \"AlertDialogAction\";\nconst AlertDialogCancel = React.forwardRef<React.ElementRef<typeof AlertDialogPrimitive.Cancel>, React.ComponentPropsWithoutRef<typeof AlertDialogPrimitive.Cancel>>(({ style, ...props }, ref) => (<AlertDialogPrimitive.Cancel ref={ref} style={StyleSheet.flatten([style]) as any} {...props}/>));\nAlertDialogCancel.displayName = \"AlertDialogCancel\";\nexport { AlertDialog, AlertDialogAction, AlertDialogCancel, AlertDialogContent, AlertDialogDescription, AlertDialogFooter, AlertDialogHeader, AlertDialogOverlay, AlertDialogPortal, AlertDialogTitle, AlertDialogTrigger, };\nexport const AlertDialogPrimitiveWrapper = {\n    Root: AlertDialog,\n    Trigger: AlertDialogTrigger,\n    Portal: AlertDialogPortal,\n    Overlay: AlertDialogOverlay,\n    Content: AlertDialogContent,\n    Header: AlertDialogHeader,\n    Footer: AlertDialogFooter,\n    Title: AlertDialogTitle,\n    Description: AlertDialogDescription,\n    Action: AlertDialogAction,\n    Cancel: AlertDialogCancel,\n};"
    }
  ]
}
