{
  "$schema": "https://nativeui.qzz.io/schema/registry-item.json",
  "name": "alert",
  "type": "registry:component",
  "title": "Alert",
  "description": "Alert component",
  "registryDependencies": [],
  "dependencies": [],
  "category": "feedback",
  "files": [
    {
      "path": "components/ui/alert.tsx",
      "type": "registry:component",
      "target": "components/ui/alert.tsx",
      "content": "import { THEME, useTheme } from \"@/lib/theme\";\nimport React, { forwardRef } from \"react\";\nimport { StyleProp, StyleSheet, Text, TextProps, TextStyle, View, ViewProps, ViewStyle, } from \"react-native\";\nexport type AlertVariant = \"default\" | \"destructive\" | \"warning\" | \"success\" | \"info\";\nconst VARIANT_PALETTE: Record<AlertVariant, {\n    accent: string;\n    bg: string;\n    bgDark: string;\n}> = {\n    default: { accent: \"#71717a\", bg: \"#fafafa\", bgDark: \"#18181b\" },\n    destructive: { accent: \"#dc2626\", bg: \"#fff1f1\", bgDark: \"#2a0a0a\" },\n    warning: { accent: \"#d97706\", bg: \"#fffbeb\", bgDark: \"#1c1500\" },\n    success: { accent: \"#16a34a\", bg: \"#f0fdf4\", bgDark: \"#071a0e\" },\n    info: { accent: \"#2563eb\", bg: \"#eff6ff\", bgDark: \"#040d1f\" },\n};\ntype AlertContextValue = {\n    variant: AlertVariant;\n    accentColor: string;\n};\nconst AlertContext = React.createContext<AlertContextValue>({\n    variant: \"default\",\n    accentColor: VARIANT_PALETTE.default.accent,\n});\nconst useAlertContext = () => React.useContext(AlertContext);\ntype AlertProps = ViewProps & {\n    variant?: AlertVariant;\n    style?: StyleProp<ViewStyle>;\n};\ntype IconProps = {\n    color?: string;\n    size?: number;\n};\nconst Alert = forwardRef<View, AlertProps>(({ children, variant = \"default\", style, ...props }, ref) => {\n    const { theme } = useTheme();\n    const { colors, spacing, radius } = THEME[theme];\n    const palette = VARIANT_PALETTE[variant];\n    const accentColor = variant === \"default\" ? colors.mutedForeground : palette.accent;\n    const bgColor = theme === \"dark\" ? palette.bgDark : palette.bg;\n    const childArray = React.Children.toArray(children);\n    const alertSubNames = new Set([\n        \"AlertTitle\",\n        \"AlertDescription\",\n        \"AlertAction\",\n    ]);\n    let iconChild: React.ReactNode = null;\n    let restChildren: React.ReactNode[] = childArray;\n    const first = childArray[0] as React.ReactElement | undefined;\n    if (first &&\n        React.isValidElement(first) &&\n        !alertSubNames.has((first.type as any)?.displayName ?? \"\")) {\n        iconChild = first;\n        restChildren = childArray.slice(1);\n    }\n    const iconElement = iconChild as React.ReactElement<IconProps> | null;\n    return (<AlertContext.Provider value={{ variant, accentColor }}>\n        <View ref={ref} accessibilityRole=\"alert\" {...props} style={[\n            styles.root,\n            {\n                backgroundColor: bgColor,\n                borderColor: colors.border,\n                borderLeftColor: accentColor,\n                borderRadius: radius.lg,\n                padding: spacing.lg,\n                gap: spacing.xs,\n            },\n            style,\n        ]}>\n          <View style={styles.row}>\n            {iconElement ? (<View style={[styles.iconSlot, { marginTop: 1 }]}>\n                {React.cloneElement(iconElement, {\n                color: iconElement.props.color ?? accentColor,\n                size: iconElement.props.size ?? 18,\n            })}\n              </View>) : null}\n\n            <View style={styles.contentColumn}>{restChildren}</View>\n          </View>\n        </View>\n      </AlertContext.Provider>);\n});\nAlert.displayName = \"Alert\";\ntype AlertTitleProps = TextProps & {\n    style?: StyleProp<TextStyle>;\n};\nconst AlertTitle = forwardRef<Text, AlertTitleProps>(({ children, style, ...props }, ref) => {\n    const { theme } = useTheme();\n    const { colors, typography } = THEME[theme];\n    return (<Text ref={ref} accessibilityRole=\"header\" {...props} style={[\n            styles.title,\n            {\n                color: colors.foreground,\n                fontSize: typography.sm,\n            },\n            style,\n        ]}>\n        {children}\n      </Text>);\n});\nAlertTitle.displayName = \"AlertTitle\";\ntype AlertDescriptionProps = TextProps & {\n    style?: StyleProp<TextStyle>;\n};\nconst AlertDescription = forwardRef<Text, AlertDescriptionProps>(({ children, style, ...props }, ref) => {\n    const { theme } = useTheme();\n    const { colors, typography, spacing } = THEME[theme];\n    return (<Text ref={ref} {...props} style={[\n            {\n                color: colors.mutedForeground,\n                fontSize: typography.xs,\n                lineHeight: typography.xs * 1.55,\n                marginTop: spacing.xs,\n            },\n            style,\n        ]}>\n        {children}\n      </Text>);\n});\nAlertDescription.displayName = \"AlertDescription\";\ntype AlertActionProps = ViewProps & {\n    style?: StyleProp<ViewStyle>;\n};\nconst AlertAction = forwardRef<View, AlertActionProps>(({ children, style, ...props }, ref) => {\n    const { theme } = useTheme();\n    const { spacing } = THEME[theme];\n    return (<View ref={ref} {...props} style={[{ marginTop: spacing.sm, alignSelf: \"flex-start\" }, style]}>\n        {children}\n      </View>);\n});\nAlertAction.displayName = \"AlertAction\";\nconst styles = StyleSheet.create({\n    root: {\n        borderWidth: 1,\n        borderLeftWidth: 4,\n    },\n    row: {\n        flexDirection: \"row\",\n        alignItems: \"flex-start\",\n    },\n    iconSlot: {\n        marginRight: 12,\n        flexShrink: 0,\n    },\n    contentColumn: {\n        flex: 1,\n    },\n    title: {\n        fontWeight: \"600\",\n        letterSpacing: 0.1,\n    },\n});\nexport { Alert, AlertAction, AlertDescription, AlertTitle };"
    }
  ]
}
