{
  "$schema": "https://nativeui.qzz.io/schema/registry-item.json",
  "name": "typography",
  "type": "registry:component",
  "title": "Typography",
  "description": "Typography component",
  "registryDependencies": [],
  "dependencies": [],
  "category": "typography",
  "files": [
    {
      "path": "components/ui/typography.tsx",
      "type": "registry:component",
      "target": "components/ui/typography.tsx",
      "content": "import { THEME, useTheme } from \"@/lib/theme\";\nimport { forwardRef } from \"react\";\nimport { Platform, Text, View, type StyleProp, type TextProps, type TextStyle, type ViewStyle, } from \"react-native\";\nexport type TypographyVariant = \"h1\" | \"h2\" | \"h3\" | \"h4\" | \"p\" | \"lead\" | \"large\" | \"small\" | \"muted\" | \"blockquote\" | \"code\" | \"label\" | \"caption\";\ntype BaseProps = {\n    style?: StyleProp<TextStyle>;\n} & Omit<TextProps, \"style\">;\ntype TypographyProps = ({\n    variant?: Exclude<TypographyVariant, \"blockquote\" | \"code\">;\n} & BaseProps) | ({\n    variant: \"blockquote\" | \"code\";\n    containerStyle?: StyleProp<ViewStyle>;\n} & BaseProps);\nconst HEADING_VARIANTS = new Set<TypographyVariant>([\"h1\", \"h2\", \"h3\", \"h4\"]);\nconst MONO_FONT = Platform.select<string>({\n    ios: \"Courier New\",\n    android: \"monospace\",\n    default: \"monospace\",\n});\nconst Typography = forwardRef<Text, TypographyProps>((props, ref) => {\n    const { variant = \"p\", children, style, accessibilityRole, accessibilityLabel, ...restProps } = props;\n    const { containerStyle, ...textProps } = restProps as typeof restProps & {\n        containerStyle?: StyleProp<ViewStyle>;\n    };\n    const { theme } = useTheme();\n    const { colors, spacing, radius, typography } = THEME[theme];\n    const variantStyle = ((): TextStyle => {\n        switch (variant) {\n            case \"h1\":\n                return {\n                    fontSize: typography[\"2xl\"],\n                    fontWeight: \"800\",\n                    letterSpacing: -0.5,\n                    lineHeight: typography[\"2xl\"] * 1.2,\n                    color: colors.foreground,\n                };\n            case \"h2\":\n                return {\n                    fontSize: typography.xl,\n                    fontWeight: \"700\",\n                    letterSpacing: -0.3,\n                    lineHeight: typography.xl * 1.25,\n                    color: colors.foreground,\n                };\n            case \"h3\":\n                return {\n                    fontSize: typography.lg,\n                    fontWeight: \"600\",\n                    letterSpacing: -0.2,\n                    lineHeight: typography.lg * 1.3,\n                    color: colors.foreground,\n                };\n            case \"h4\":\n                return {\n                    fontSize: typography.base,\n                    fontWeight: \"600\",\n                    letterSpacing: -0.1,\n                    lineHeight: typography.base * 1.4,\n                    color: colors.foreground,\n                };\n            case \"p\":\n                return {\n                    fontSize: typography.base,\n                    fontWeight: \"400\",\n                    lineHeight: typography.base * 1.6,\n                    color: colors.foreground,\n                };\n            case \"lead\":\n                return {\n                    fontSize: typography.lg,\n                    fontWeight: \"400\",\n                    lineHeight: typography.lg * 1.55,\n                    color: colors.mutedForeground,\n                };\n            case \"large\":\n                return {\n                    fontSize: typography.lg,\n                    fontWeight: \"600\",\n                    lineHeight: typography.lg * 1.3,\n                    color: colors.foreground,\n                };\n            case \"small\":\n                return {\n                    fontSize: typography.sm,\n                    fontWeight: \"500\",\n                    lineHeight: typography.sm * 1.4,\n                    color: colors.foreground,\n                };\n            case \"muted\":\n                return {\n                    fontSize: typography.sm,\n                    fontWeight: \"400\",\n                    lineHeight: typography.sm * 1.4,\n                    color: colors.mutedForeground,\n                };\n            case \"blockquote\":\n                return {\n                    fontSize: typography.base,\n                    fontWeight: \"400\",\n                    fontStyle: \"italic\",\n                    lineHeight: typography.base * 1.6,\n                    color: colors.mutedForeground,\n                };\n            case \"code\":\n                return {\n                    fontFamily: MONO_FONT,\n                    fontSize: typography.sm,\n                    fontWeight: \"400\",\n                    lineHeight: typography.sm * 1.5,\n                    color: colors.foreground,\n                };\n            case \"label\":\n                return {\n                    fontSize: typography.xs,\n                    fontWeight: \"600\",\n                    letterSpacing: 0.6,\n                    textTransform: \"uppercase\",\n                    lineHeight: typography.xs * 1.4,\n                    color: colors.foreground,\n                };\n            case \"caption\":\n                return {\n                    fontSize: typography.xs,\n                    fontWeight: \"400\",\n                    lineHeight: typography.xs * 1.4,\n                    color: colors.mutedForeground,\n                };\n        }\n    })();\n    const resolvedRole = accessibilityRole ?? (HEADING_VARIANTS.has(variant) ? \"header\" : undefined);\n    const textNode = (<Text ref={ref} accessibilityRole={resolvedRole} accessibilityLabel={accessibilityLabel} {...textProps} style={[variantStyle, style]}>\n      {children}\n    </Text>);\n    if (variant === \"blockquote\") {\n        return (<View style={[\n                {\n                    borderLeftWidth: 3,\n                    borderLeftColor: colors.border,\n                    paddingLeft: spacing.md,\n                    alignSelf: \"stretch\",\n                },\n                containerStyle,\n            ]} importantForAccessibility=\"no\">\n        {textNode}\n      </View>);\n    }\n    if (variant === \"code\") {\n        return (<View style={[\n                {\n                    alignSelf: \"flex-start\",\n                    backgroundColor: colors.muted,\n                    borderRadius: radius.sm,\n                    paddingHorizontal: spacing.sm,\n                    paddingVertical: spacing.xs / 2,\n                },\n                containerStyle,\n            ]} importantForAccessibility=\"no\">\n        {textNode}\n      </View>);\n    }\n    return textNode;\n});\nTypography.displayName = \"Typography\";\nexport default Typography;"
    }
  ]
}
