{
  "$schema": "https://nativeui.qzz.io/schema/registry-item.json",
  "name": "table",
  "type": "registry:component",
  "title": "Table",
  "description": "Table component",
  "registryDependencies": [],
  "dependencies": ["@rn-primitives/table"],
  "category": "layout",
  "files": [
    {
      "path": "components/ui/table.tsx",
      "type": "registry:component",
      "target": "components/ui/table.tsx",
      "content": "import { THEME, useTheme } from \"@/lib/theme\";\nimport * as TablePrimitive from \"@rn-primitives/table\";\nimport * as React from \"react\";\nimport { ScrollView, StyleSheet, Text, View, type StyleProp, type TextStyle, } from \"react-native\";\nconst isTextOnly = (children: React.ReactNode): boolean => {\n    if (typeof children === \"string\" || typeof children === \"number\")\n        return true;\n    if (Array.isArray(children)) {\n        return children.every((child) => typeof child === \"string\" || typeof child === \"number\" || child == null);\n    }\n    return false;\n};\nconst Table = React.forwardRef<React.ElementRef<typeof TablePrimitive.Root>, React.ComponentPropsWithoutRef<typeof TablePrimitive.Root>>(({ style, ...props }, ref) => {\n    return (<ScrollView horizontal showsHorizontalScrollIndicator={true} contentContainerStyle={{ minWidth: \"100%\" }}>\n      <TablePrimitive.Root ref={ref} style={[{ width: \"100%\" }, style]} {...props}/>\n    </ScrollView>);\n});\nTable.displayName = \"Table\";\nconst TableHeader = React.forwardRef<React.ElementRef<typeof TablePrimitive.Header>, React.ComponentPropsWithoutRef<typeof TablePrimitive.Header>>(({ style, ...props }, ref) => {\n    const { theme } = useTheme();\n    const { colors } = THEME[theme];\n    return (<TablePrimitive.Header ref={ref} style={[\n            {\n                borderBottomWidth: 1,\n                borderBottomColor: colors.border,\n            },\n            style,\n        ]} {...props}/>);\n});\nTableHeader.displayName = \"TableHeader\";\nconst TableBody = React.forwardRef<React.ElementRef<typeof TablePrimitive.Body>, React.ComponentPropsWithoutRef<typeof TablePrimitive.Body>>(({ style, ...props }, ref) => {\n    return <TablePrimitive.Body ref={ref} style={[style]} {...props}/>;\n});\nTableBody.displayName = \"TableBody\";\nconst TableFooter = React.forwardRef<React.ElementRef<typeof TablePrimitive.Footer>, React.ComponentPropsWithoutRef<typeof TablePrimitive.Footer>>(({ style, ...props }, ref) => {\n    const { theme } = useTheme();\n    const { colors } = THEME[theme];\n    return (<TablePrimitive.Footer ref={ref} style={[\n            {\n                borderTopWidth: 1,\n                borderTopColor: colors.border,\n                backgroundColor: theme === \"dark\" ? \"rgba(255,255,255,0.05)\" : \"rgba(0,0,0,0.03)\",\n            },\n            style,\n        ]} {...props}/>);\n});\nTableFooter.displayName = \"TableFooter\";\nconst TableRow = React.forwardRef<React.ElementRef<typeof TablePrimitive.Row>, React.ComponentPropsWithoutRef<typeof TablePrimitive.Row>>(({ style, ...props }, ref) => {\n    const { theme } = useTheme();\n    const { colors } = THEME[theme];\n    return (<TablePrimitive.Row ref={ref} style={(state) => [\n            {\n                flexDirection: \"row\",\n                borderBottomWidth: StyleSheet.hairlineWidth,\n                borderBottomColor: colors.border,\n            },\n            typeof style === \"function\" ? style(state) : style,\n        ]} {...props}/>);\n});\nTableRow.displayName = \"TableRow\";\ntype TableCellProps = React.ComponentPropsWithoutRef<typeof TablePrimitive.Cell> & {\n    textStyle?: StyleProp<TextStyle>;\n};\nconst TableHead = React.forwardRef<React.ElementRef<typeof TablePrimitive.Head>, TableCellProps>(({ style, textStyle, children, ...props }, ref) => {\n    const { theme } = useTheme();\n    const { colors, typography } = THEME[theme];\n    return (<TablePrimitive.Head ref={ref} style={[\n            {\n                height: 40,\n                paddingHorizontal: 8,\n                justifyContent: \"center\",\n                alignItems: \"flex-start\",\n                flex: 1,\n            },\n            style,\n        ]} {...props}>\n      {isTextOnly(children) ? (<Text numberOfLines={1} style={[\n                {\n                    color: colors.mutedForeground,\n                    fontSize: typography.sm,\n                    fontWeight: \"600\",\n                },\n                textStyle,\n            ]}>\n          {children}\n        </Text>) : (children)}\n    </TablePrimitive.Head>);\n});\nTableHead.displayName = \"TableHead\";\nconst TableCell = React.forwardRef<React.ElementRef<typeof TablePrimitive.Cell>, TableCellProps>(({ style, textStyle, children, ...props }, ref) => {\n    const { theme } = useTheme();\n    const { colors, typography } = THEME[theme];\n    return (<TablePrimitive.Cell ref={ref} style={[\n            {\n                paddingVertical: 12,\n                paddingHorizontal: 8,\n                justifyContent: \"center\",\n                alignItems: \"flex-start\",\n                flex: 1,\n            },\n            style,\n        ]} {...props}>\n      {isTextOnly(children) ? (<Text style={[\n                {\n                    color: colors.foreground,\n                    fontSize: typography.sm,\n                },\n                textStyle,\n            ]}>\n          {children}\n        </Text>) : (children)}\n    </TablePrimitive.Cell>);\n});\nTableCell.displayName = \"TableCell\";\nconst TableCaption = React.forwardRef<React.ElementRef<typeof Text>, React.ComponentPropsWithoutRef<typeof Text>>(({ style, ...props }, ref) => {\n    const { theme } = useTheme();\n    const { colors, typography } = THEME[theme];\n    return (<View style={{ marginTop: 16, marginBottom: 8, alignItems: \"center\" }}>\n      <Text ref={ref} style={[\n            {\n                color: colors.mutedForeground,\n                fontSize: typography.sm,\n                textAlign: \"center\",\n            },\n            style,\n        ]} {...props}/>\n    </View>);\n});\nTableCaption.displayName = \"TableCaption\";\nexport { Table, TableBody, TableCaption, TableCell, TableFooter, TableHead, TableHeader, TableRow, };"
    }
  ]
}
