{
  "$schema": "https://nativeui.qzz.io/schema/registry-item.json",
  "name": "aspect-ratio",
  "type": "registry:component",
  "title": "Aspect Ratio",
  "description": "Aspect Ratio component",
  "registryDependencies": [],
  "dependencies": ["@rn-primitives/aspect-ratio"],
  "category": "layout",
  "files": [
    {
      "path": "components/ui/aspect-ratio.tsx",
      "type": "registry:component",
      "target": "components/ui/aspect-ratio.tsx",
      "content": "import * as AspectRatioPrimitive from \"@rn-primitives/aspect-ratio\";\nconst AspectRatio = AspectRatioPrimitive.Root;\nexport default AspectRatio;"
    }
  ]
}
