{
  "$schema": "https://nativeui.qzz.io/schema/registry-item.json",
  "name": "empty",
  "type": "registry:component",
  "title": "Empty",
  "description": "Empty component",
  "registryDependencies": [],
  "dependencies": [],
  "category": "feedback",
  "files": [
    {
      "path": "components/ui/empty.tsx",
      "type": "registry:component",
      "target": "components/ui/empty.tsx",
      "content": "import { THEME, useTheme } from \"@/lib/theme\";\nimport { forwardRef } from \"react\";\nimport { Text, View, type TextProps, type ViewProps } from \"react-native\";\ntype EmptyProps = ViewProps;\nexport const Empty = forwardRef<View, EmptyProps>(({ style, ...rest }, ref) => {\n    const { theme } = useTheme();\n    const { spacing } = THEME[theme];\n    return (<View ref={ref} {...rest} style={[\n            {\n                flex: 1,\n                alignItems: \"center\",\n                justifyContent: \"center\",\n                padding: spacing.xl,\n            },\n            style,\n        ]}/>);\n});\nEmpty.displayName = \"Empty\";\ntype EmptyHeaderProps = ViewProps;\nexport const EmptyHeader = forwardRef<View, EmptyHeaderProps>(({ style, ...rest }, ref) => {\n    const { theme } = useTheme();\n    const { spacing } = THEME[theme];\n    return (<View ref={ref} {...rest} style={[\n            {\n                alignItems: \"center\",\n                gap: spacing.sm,\n                marginBottom: spacing.md,\n            },\n            style,\n        ]}/>);\n});\nEmptyHeader.displayName = \"EmptyHeader\";\ntype EmptyMediaVariant = \"icon\" | \"image\";\ntype EmptyMediaProps = {\n    variant?: EmptyMediaVariant;\n} & ViewProps;\nexport const EmptyMedia = forwardRef<View, EmptyMediaProps>(({ variant = \"icon\", style, ...rest }, ref) => {\n    const { theme } = useTheme();\n    const { colors, radius, spacing } = THEME[theme];\n    return (<View ref={ref} {...rest} style={[\n            {\n                alignItems: \"center\",\n                justifyContent: \"center\",\n                marginBottom: spacing.md,\n            },\n            variant === \"icon\" && {\n                width: 64,\n                height: 64,\n                backgroundColor: colors.muted,\n                borderRadius: radius.full,\n            },\n            style,\n        ]}/>);\n});\nEmptyMedia.displayName = \"EmptyMedia\";\ntype EmptyTitleProps = TextProps;\nexport const EmptyTitle = forwardRef<Text, EmptyTitleProps>(({ style, ...rest }, ref) => {\n    const { theme } = useTheme();\n    const { colors, typography } = THEME[theme];\n    return (<Text ref={ref} accessibilityRole=\"header\" {...rest} style={[\n            {\n                color: colors.foreground,\n                fontSize: typography.xl,\n                fontWeight: \"600\",\n                textAlign: \"center\",\n            },\n            style,\n        ]}/>);\n});\nEmptyTitle.displayName = \"EmptyTitle\";\ntype EmptyDescriptionProps = TextProps;\nexport const EmptyDescription = forwardRef<Text, EmptyDescriptionProps>(({ style, ...rest }, ref) => {\n    const { theme } = useTheme();\n    const { colors, typography } = THEME[theme];\n    return (<Text ref={ref} {...rest} style={[\n            {\n                color: colors.mutedForeground,\n                fontSize: typography.sm,\n                textAlign: \"center\",\n                lineHeight: typography.sm * 1.5,\n                maxWidth: 280,\n            },\n            style,\n        ]}/>);\n});\nEmptyDescription.displayName = \"EmptyDescription\";\ntype EmptyContentProps = ViewProps;\nexport const EmptyContent = forwardRef<View, EmptyContentProps>(({ style, ...rest }, ref) => {\n    const { theme } = useTheme();\n    const { spacing } = THEME[theme];\n    return (<View ref={ref} {...rest} style={[\n            {\n                alignItems: \"center\",\n                width: \"100%\",\n                gap: spacing.sm,\n            },\n            style,\n        ]}/>);\n});\nEmptyContent.displayName = \"EmptyContent\";"
    }
  ]
}
