{
  "$schema": "https://nativeui.qzz.io/schema/registry-item.json",
  "name": "button",
  "type": "registry:component",
  "title": "Button",
  "description": "Button component",
  "registryDependencies": ["button-group"],
  "dependencies": ["react-native-reanimated"],
  "category": "primitives",
  "files": [
    {
      "path": "components/ui/button.tsx",
      "type": "registry:component",
      "target": "components/ui/button.tsx",
      "content": "import { THEME, useTheme, type Theme } from \"@/lib/theme\";\nimport { useButtonGroupItem } from \"@/components/ui/button-group\";\nimport { forwardRef } from \"react\";\nimport { ActivityIndicator, type PressableProps, type StyleProp, StyleSheet, Text, type TextStyle, View, type ViewStyle, } from \"react-native\";\nimport Animated, { Easing, interpolateColor, useAnimatedStyle, useSharedValue, withTiming, } from \"react-native-reanimated\";\nexport type ButtonVariant = \"default\" | \"outline\" | \"secondary\" | \"ghost\" | \"link\" | \"destructive\";\nexport type ButtonProps = {\n    title?: string;\n    onPress?: () => void;\n    containerStyle?: StyleProp<ViewStyle>;\n    buttonStyle?: StyleProp<ViewStyle & TextStyle>;\n    textStyle?: StyleProp<TextStyle>;\n    disabled?: boolean;\n    loading?: boolean;\n    children?: React.ReactNode;\n    variant?: ButtonVariant;\n    pressedEffect?: boolean;\n    color?: string;\n} & Omit<PressableProps, \"style\" | \"onPress\">;\ntype VariantStyle = {\n    button: ViewStyle;\n    text: TextStyle;\n    normalBg: string;\n    pressedBg: string;\n};\nconst getVariantStyles = (theme: Theme, variant: ButtonVariant): VariantStyle => {\n    const { colors } = THEME[theme];\n    switch (variant) {\n        case \"default\":\n            return {\n                button: { backgroundColor: colors.primary },\n                text: { color: colors.primaryForeground, fontWeight: \"600\" },\n                normalBg: colors.primary,\n                pressedBg: colors.primary + \"e6\",\n            };\n        case \"outline\":\n            return {\n                button: {\n                    backgroundColor: \"transparent\",\n                    borderWidth: 1.5,\n                    borderColor: colors.border,\n                },\n                text: { color: colors.foreground, fontWeight: \"600\" },\n                normalBg: \"transparent\",\n                pressedBg: colors.accent,\n            };\n        case \"secondary\":\n            return {\n                button: { backgroundColor: colors.secondary },\n                text: { color: colors.secondaryForeground, fontWeight: \"600\" },\n                normalBg: colors.secondary,\n                pressedBg: colors.secondaryForeground + \"20\",\n            };\n        case \"ghost\":\n            return {\n                button: { backgroundColor: \"transparent\" },\n                text: { color: colors.foreground, fontWeight: \"500\" },\n                normalBg: \"transparent\",\n                pressedBg: colors.accent,\n            };\n        case \"link\":\n            return {\n                button: { backgroundColor: \"transparent\" },\n                text: {\n                    color: colors.primary,\n                    fontWeight: \"500\",\n                    textDecorationLine: \"underline\",\n                },\n                normalBg: \"transparent\",\n                pressedBg: \"transparent\",\n            };\n        case \"destructive\":\n            return {\n                button: { backgroundColor: colors.destructive },\n                text: { color: colors.destructiveForeground, fontWeight: \"600\" },\n                normalBg: colors.destructive,\n                pressedBg: colors.destructive + \"cc\",\n            };\n    }\n};\nconst TIMING_CONFIG = {\n    duration: 180,\n    easing: Easing.inOut(Easing.ease),\n};\nconst AnimatedPressable = Animated.createAnimatedComponent(require(\"react-native\").Pressable);\nconst Button = forwardRef<View, ButtonProps>(({ title, onPress, containerStyle, buttonStyle, textStyle, disabled = false, loading = false, children, variant = \"default\", pressedEffect = true, color, accessibilityLabel, accessibilityHint, ...rest }, ref) => {\n    const { theme } = useTheme();\n    const { colors, spacing, radius, typography } = THEME[theme];\n    const pressProgress = useSharedValue(0);\n    const { isInGroup, orientation, buttonStyle: groupButtonStyle, } = useButtonGroupItem();\n    const variantStyles = getVariantStyles(theme, variant);\n    const isDisabled = disabled || loading;\n    const flatButtonStyle = StyleSheet.flatten(buttonStyle) ?? {};\n    const resolvedTextColor = color ?? (flatButtonStyle.color as string | undefined);\n    const animatedStyle = useAnimatedStyle(() => {\n        if (!pressedEffect)\n            return {};\n        return {\n            backgroundColor: interpolateColor(pressProgress.value, [0, 1], [variantStyles.normalBg, variantStyles.pressedBg]),\n            transform: [\n                {\n                    scale: withTiming(pressProgress.value === 1 ? 0.98 : 1, TIMING_CONFIG),\n                },\n            ],\n        };\n    });\n    const handlePressIn = () => {\n        if (!pressedEffect)\n            return;\n        pressProgress.value = withTiming(1, TIMING_CONFIG);\n    };\n    const handlePressOut = () => {\n        if (!pressedEffect)\n            return;\n        pressProgress.value = withTiming(0, TIMING_CONFIG);\n    };\n    const loaderColor = resolvedTextColor ??\n        (variant === \"default\" ? colors.primaryForeground : colors.primary);\n    return (<View ref={ref} style={[\n            isInGroup && orientation === \"horizontal\"\n                ? { flex: 1 }\n                : { width: \"100%\" },\n            { opacity: isDisabled ? 0.5 : 1 },\n            containerStyle,\n        ]}>\n        <AnimatedPressable onPress={onPress} onPressIn={handlePressIn} onPressOut={handlePressOut} disabled={isDisabled} accessibilityRole=\"button\" accessibilityLabel={accessibilityLabel ?? title ?? undefined} accessibilityHint={accessibilityHint} accessibilityState={{\n            disabled: isDisabled,\n            busy: loading,\n        }} {...rest} style={[\n            {\n                paddingHorizontal: spacing.lg,\n                paddingVertical: spacing.md,\n                borderRadius: radius.lg,\n                alignItems: \"center\",\n                justifyContent: \"center\",\n                width: \"100%\",\n                height: 50,\n                flexDirection: \"row\",\n                gap: spacing.sm,\n            },\n            variantStyles.button,\n            animatedStyle,\n            groupButtonStyle,\n            buttonStyle,\n        ]}>\n          {loading ? (<ActivityIndicator size=\"small\" color={loaderColor} accessibilityLabel=\"Loading\"/>) : (<>\n              {children}\n              {title && (<Text style={[\n                    {\n                        fontSize: typography.base,\n                        letterSpacing: 0.2,\n                    },\n                    variantStyles.text,\n                    resolvedTextColor ? { color: resolvedTextColor } : null,\n                    textStyle,\n                ]} importantForAccessibility=\"no\" accessibilityElementsHidden>\n                  {title}\n                </Text>)}\n            </>)}\n        </AnimatedPressable>\n      </View>);\n});\nButton.displayName = \"Button\";\nexport default Button;"
    }
  ]
}
