{
  "$schema": "https://nativeui.qzz.io/schema/registry-item.json",
  "name": "card",
  "type": "registry:component",
  "title": "Card",
  "description": "Card component",
  "registryDependencies": [],
  "dependencies": [],
  "category": "layout",
  "files": [
    {
      "path": "components/ui/card.tsx",
      "type": "registry:component",
      "target": "components/ui/card.tsx",
      "content": "import { THEME, useTheme } from \"@/lib/theme\";\nimport { forwardRef } from \"react\";\nimport { View, Text, type ViewStyle, type TextStyle, type ViewProps, type TextProps, } from \"react-native\";\ntype CardSize = \"default\" | \"sm\";\ntype CardProps = {\n    size?: CardSize;\n    style?: ViewStyle;\n} & Omit<ViewProps, \"style\">;\nexport const Card = forwardRef<View, CardProps>(({ children, size = \"default\", style, ...rest }, ref) => {\n    const { theme } = useTheme();\n    const { colors, radius, spacing } = THEME[theme];\n    return (<View ref={ref} {...rest} style={[\n            {\n                backgroundColor: colors.card,\n                borderRadius: size === \"sm\" ? radius.lg : radius.xl,\n                borderWidth: 1,\n                borderColor: colors.border,\n                overflow: \"hidden\",\n                padding: size === \"sm\" ? spacing.md : spacing.lg,\n            },\n            style,\n        ]}>\n        {children}\n      </View>);\n});\nCard.displayName = \"Card\";\ntype CardSectionProps = {\n    style?: ViewStyle;\n} & Omit<ViewProps, \"style\">;\nexport const CardHeader = forwardRef<View, CardSectionProps>(({ children, style, ...rest }, ref) => {\n    const { spacing } = THEME[useTheme().theme];\n    return (<View ref={ref} {...rest} style={[\n            {\n                flexDirection: \"row\",\n                justifyContent: \"space-between\",\n                alignItems: \"flex-start\",\n                marginBottom: spacing.md,\n                gap: spacing.sm,\n            },\n            style,\n        ]}>\n        {children}\n      </View>);\n});\nCardHeader.displayName = \"CardHeader\";\ntype CardTitleProps = {\n    style?: TextStyle;\n} & Omit<TextProps, \"style\">;\nexport const CardTitle = forwardRef<Text, CardTitleProps>(({ children, style, ...rest }, ref) => {\n    const { theme } = useTheme();\n    const { colors, typography } = THEME[theme];\n    return (<Text ref={ref} accessibilityRole=\"header\" {...rest} style={[\n            {\n                color: colors.cardForeground,\n                fontSize: typography.lg,\n                fontWeight: \"700\",\n                flexShrink: 1,\n            },\n            style,\n        ]}>\n        {children}\n      </Text>);\n});\nCardTitle.displayName = \"CardTitle\";\nexport const CardDescription = forwardRef<Text, CardTitleProps>(({ children, style, ...rest }, ref) => {\n    const { theme } = useTheme();\n    const { colors, typography, spacing } = THEME[theme];\n    return (<Text ref={ref} {...rest} style={[\n            {\n                color: colors.mutedForeground,\n                fontSize: typography.sm,\n                lineHeight: typography.sm * 1.4,\n                marginTop: spacing.xs / 2,\n            },\n            style,\n        ]}>\n        {children}\n      </Text>);\n});\nCardDescription.displayName = \"CardDescription\";\nexport const CardTitleGroup = forwardRef<View, CardSectionProps>(({ children, style, ...rest }, ref) => (<View ref={ref} {...rest} style={[{ flex: 1, gap: 2 }, style]}>\n      {children}\n    </View>));\nCardTitleGroup.displayName = \"CardTitleGroup\";\nexport const CardAction = forwardRef<View, CardSectionProps>(({ children, style, ...rest }, ref) => (<View ref={ref} {...rest} style={[{ flexShrink: 0 }, style]}>\n      {children}\n    </View>));\nCardAction.displayName = \"CardAction\";\nexport const CardContent = forwardRef<View, CardSectionProps>(({ children, style, ...rest }, ref) => {\n    const { spacing } = THEME[useTheme().theme];\n    return (<View ref={ref} {...rest} style={[{ gap: spacing.sm }, style]}>\n        {children}\n      </View>);\n});\nCardContent.displayName = \"CardContent\";\nexport const CardFooter = forwardRef<View, CardSectionProps>(({ children, style, ...rest }, ref) => {\n    const { theme } = useTheme();\n    const { colors, spacing } = THEME[theme];\n    return (<View ref={ref} {...rest} style={[\n            {\n                flexDirection: \"row\",\n                alignItems: \"center\",\n                justifyContent: \"flex-end\",\n                gap: spacing.sm,\n                marginTop: spacing.md,\n                paddingTop: spacing.md,\n                borderTopWidth: 1,\n                borderTopColor: colors.border,\n            },\n            style,\n        ]}>\n        {children}\n      </View>);\n});\nCardFooter.displayName = \"CardFooter\";"
    }
  ]
}
